id,title,description,availibility,condition,price,link,image_link,BRAND,category,sub-category,length,colour,pattern,fit
57,Stacy Dress In Mint,"Step into elegance with the Stacy Dress in Mint. This beautiful dress features a refreshing mint color and a stylish design, perfect for a classy and sophisticated look. Ideal for formal occasions or special events.",in stock,new,39 USD,https://netcoredemo.myshopify.com/collections/dress/products/1057,https://cdn.shopify.com/s/files/1/0370/4861/5048/products/tnstacy_dress_in_mint.jpg?v=1586241024,Netcore,Dresses,dress,mini,green,solid,slit
58,Electric Babe Dress In Lemon,Embrace your vibrant side with the Electric Babe Dress in Lemon. The eye-catching lemon color and playful design make this dress a standout choice for fun-filled outings and summer parties. Get ready to make a bold fashion statement.,in stock,new,55 USD,https://netcoredemo.myshopify.com/collections/dress/products/1058,https://cdn.shopify.com/s/files/1/0370/4861/5048/products/2019.12.6_560.jpg?v=1586241027,Netcore,Dresses,dress,mini,yellow,solid,slit
59,My Love Is Yours Dress In Black Satin,Indulge in romance with the My Love Is Yours Dress in Black Satin. The luxurious black satin fabric and alluring design create a captivating look that's perfect for a glamorous evening affair or a special date night.,in stock,new,55 USD,https://netcoredemo.myshopify.com/collections/dress/products/1059,https://cdn.shopify.com/s/files/1/0370/4861/5048/products/romy_love_is_yours_dress_in_black.jpg?v=1586241030,Netcore,Dresses,dress,mini,black,solid,slit
60,Never Looked Better Dress In Yellow,Elevate your style with the Never Looked Better Dress in Yellow. The vibrant yellow color and flattering silhouette combine to create a chic and confident look that will make you shine. Perfect for a variety of occasions.,in stock,new,29 USD,https://netcoredemo.myshopify.com/collections/dress/products/1060,https://cdn.shopify.com/s/files/1/0370/4861/5048/products/tnnever_looked_better_dress_in_yellow.jpg?v=1586241032,Netcore,Dresses,dress,mini,yellow,solid,Comfortable
61,Tropical Scenes Dress In Yellow Floral,"Embrace the beauty of tropical vibes with the Tropical Scenes Dress in Yellow Floral. The lively yellow color and vibrant floral pattern create a fresh and summery look, perfect for beach vacations, garden parties, or casual outings.",in stock,new,65 USD,https://netcoredemo.myshopify.com/collections/dress/products/1061,https://cdn.shopify.com/s/files/1/0370/4861/5048/products/rotropical_scenes_dress_in_yellow_floral.jpg?v=1586241035,Netcore,Dresses,dress,midi,yellow,floral,slit
62,Turn Back Dress In Emerald,"Make a statement with the Turn Back Dress in Emerald. The rich emerald green color and stylish design exude elegance and sophistication, making it a perfect choice for formal events or special occasions.",in stock,new,65 USD,https://netcoredemo.myshopify.com/collections/dress/products/1062,https://cdn.shopify.com/s/files/1/0370/4861/5048/products/i_hope_i_never_dress_in_emerald_green_tn.jpg?v=1586241038,Netcore,Dresses,dress,maxi,green,solid,slit
63,Crossing Borders Dress In Green Floral,"Embrace a bohemian-inspired look with the Crossing Borders Dress in Green Floral. The charming green floral print and flowing silhouette create a whimsical and free-spirited style, ideal for embracing your wanderlust and exploring new horizons.",in stock,new,55 USD,https://netcoredemo.myshopify.com/collections/dress/products/1063,https://cdn.shopify.com/s/files/1/0370/4861/5048/products/tncrossing_borders_dress_in_green_floral01.jpg?v=1586241041,Netcore,Dresses,dress,mini,green,floral,Comfortable
64,Women Yellow Self Design Bodycon Dress,Flaunt your curves with confidence in the Women Yellow Self Design Bodycon Dress. The body-hugging fit and stylish self-design pattern create a sleek and fashionable look that's perfect for a night out or a glamorous event.,in stock,new,12 USD,https://netcoredemo.myshopify.com/collections/dress/products/1064,https://cdn.shopify.com/s/files/1/0370/4861/5048/products/14e2638c-bf5f-41d2-a2f2-5704060493461557211442376-FOREVER-21-Women-Dresses-4631557211441297-1.jpg?v=1586241043,Netcore,Dresses,dress,midi,yellow,solid,tight
65,Living Your Best Life Dress In Wine,Live your best life with the Living Your Best Life Dress in Wine. The deep wine color and sophisticated design make this dress a must-have for elegant evenings and upscale events. Get ready to make a lasting impression.,in stock,new,35 USD,https://netcoredemo.myshopify.com/collections/dress/products/1065,https://cdn.shopify.com/s/files/1/0370/4861/5048/products/2019.8.2__2626.jpg?v=1586241046,Netcore,Dresses,dress,maxi,red,solid,tight
66,Why I Love You Dress In Black Satin Print,Embody elegance and allure with the Why I Love You Dress in Black Satin Print. The exquisite black satin fabric and captivating print create a mesmerizing look that's perfect for special occasions or a night on the town.,in stock,new,65 USD,https://netcoredemo.myshopify.com/collections/dress/products/1066,https://cdn.shopify.com/s/files/1/0370/4861/5048/products/tn_why_i_love_you_dress_in_black_sat.jpg?v=1586241048,Netcore,Dresses,dress,maxi,blue,polka,slit
67,Spot Me If You Wish Dress In Mustard Spot,Stand out from the crowd with the Spot Me If You Wish Dress in Mustard Spot. The playful mustard color and charming spot print make this dress a fun and stylish choice for casual outings or daytime events.,in stock,new,65 USD,https://netcoredemo.myshopify.com/collections/dress/products/1067,https://cdn.shopify.com/s/files/1/0370/4861/5048/products/tnspot_me_if_you_wish_dress_in_mustard_spot_1.jpg?v=1586241051,Netcore,Dresses,dress,maxi,yellow,polka,slit
68,Got To Be Certain Dress In White Spot,Add a touch of retro charm to your wardrobe with the Got To Be Certain Dress in White Spot. The classic white color and adorable spot print create a vintage-inspired look that's perfect for a cute and feminine style.,in stock,new,35 USD,https://netcoredemo.myshopify.com/collections/dress/products/1068,https://cdn.shopify.com/s/files/1/0370/4861/5048/products/2019.8.9__70.jpg?v=1586241054,Netcore,Dresses,dress,maxi,white,polka,slit
69,Women Printed Red Maxi Dress,Make a statement with the Women Printed Red Maxi Dress. The bold red color and eye-catching print create a head-turning look that's perfect for special occasions or a glamorous night out. Get ready to steal the spotlight.,in stock,new,18 USD,https://netcoredemo.myshopify.com/collections/dress/products/1069,https://cdn.shopify.com/s/files/1/0370/4861/5048/products/e6d20e46-9b47-47b9-855b-3cabcbd1267a1569060769219-ONLY-Women-Dresses-7601569060767406-1.jpg?v=1586241056,Netcore,Dresses,dress,maxi,red,polka,Comfortable
70,Women Printed Blue Maxi Dress,Embrace a boho-chic style with the Women Printed Blue Maxi Dress. The captivating blue color and intricate print combine to create a fashionable and laid-back look that's ideal for summer adventures or casual gatherings.,in stock,new,9 USD,https://netcoredemo.myshopify.com/collections/dress/products/1070,https://cdn.shopify.com/s/files/1/0370/4861/5048/products/0343c20a-2b33-4363-9217-c6a6b3253dee1573723026112-1.jpg?v=1586241058,Netcore,Dresses,dress,maxi,blue,polka,Comfortable
71,Women Green Printed Maxi Dress,"Channel nature's beauty with the Women Green Printed Maxi Dress. The refreshing green color and mesmerizing print evoke a sense of tranquility and natural elegance, making it a perfect choice for outdoor events or garden parties.",in stock,new,7 USD,https://netcoredemo.myshopify.com/collections/dress/products/1071,https://cdn.shopify.com/s/files/1/0370/4861/5048/products/00a63b6d-4d2f-40ca-b76d-185880a6b55d1574444151980-1.jpg?v=1586241060,Netcore,Dresses,dress,maxi,green,polka,Comfortable
72,Women Mustard Yellow Off-Shoulder Printed Maxi Dress,Embrace the off-shoulder trend with the Women Mustard Yellow Off-Shoulder Printed Maxi Dress. The vibrant mustard yellow color and stylish print create a bohemian-inspired look that's perfect for summer festivals or beach vacations.,in stock,new,21 USD,https://netcoredemo.myshopify.com/collections/dress/products/1072,https://cdn.shopify.com/s/files/1/0370/4861/5048/products/50c24d50-043e-498e-b2d0-27bc9aabeae81559909910546-DOROTHY-PERKINS-Women-Dresses-8271559909909035-1.jpg?v=1586241062,Netcore,Dresses,dress,maxi,yellow,polka,Comfortable
73,Women's Short Sleeve Bodycon Dress Sexy Elegant Dot Print Cocktail Party Mermaid Midi Pencil Dress Knee Length,"Step into sophistication with the Women's Short Sleeve Bodycon Dress. The elegant dot print, knee-length silhouette, and mermaid-style hem combine to create a sexy and glamorous look that's perfect for cocktail parties and special occasions.",in stock,new,6 USD,https://netcoredemo.myshopify.com/collections/dress/products/1073,https://cdn.shopify.com/s/files/1/0370/4861/5048/products/71WobcX6H9L._SX385._SX._UX._SY._UY.jpg?v=1586241064,Netcore,Dresses,dress,maxi,green,polka,tight
74,Lettre d'amour Women Vintage Polka Dot Ruffle Deep V-Neck Backless Bodycon Maxi Dress,"Add a touch of vintage charm to your wardrobe with the Lettre d'amour Women Vintage Polka Dot Ruffle Dress. The classic polka dot print, deep V-neckline, and backless design create a feminine and flirtatious look that's perfect for special events or date nights.",in stock,new,16 USD,https://netcoredemo.myshopify.com/collections/dress/products/1074,https://cdn.shopify.com/s/files/1/0370/4861/5048/products/71miiVZ4WUL._UY606.jpg?v=1586241065,Netcore,Dresses,dress,maxi,black,polka,tight
75,Uscharm Long Dress Womens Short Sleeve O-Neck Dots Print Mermaid Dress Girls Bodycon Slim Summer,"Embrace a slim and stylish look with the Uscharm Long Dress. The short sleeves, O-neckline, and dots print create a charming and versatile dress that's perfect for summer days, casual outings, or even semi-formal occasions. Stay effortlessly chic all season long.",in stock,new,13 USD,https://netcoredemo.myshopify.com/collections/dress/products/1075,https://cdn.shopify.com/s/files/1/0370/4861/5048/products/61lW6L6YrIL._SX385._SX._UX._SY._UY.jpg?v=1586241066,Netcore,Dresses,dress,maxi,blue,polka,tight
76,Cleanse My Soul Dress In Mustard Spot,Embrace a playful and vibrant look with the Cleanse My Soul Dress in Mustard Spot. The mustard color and charming spot print create a fun and stylish dress that's perfect for casual outings or daytime events.,in stock,new,55 USD,https://netcoredemo.myshopify.com/collections/dress/products/1076,https://cdn.shopify.com/s/files/1/0370/4861/5048/products/rocleanse_my_soul_dress_in_mustard_spot.jpg?v=1586241069,Netcore,Dresses,dress,midi,yellow,polka,Comfortable
77,Women Red & White Printed A-Line Dress,"Make a statement with the Women Red & White Printed A-Line Dress. The bold red and white print, combined with the flattering A-line silhouette, create a chic and stylish look that's perfect for both casual and semi-formal occasions.",in stock,new,20 USD,https://netcoredemo.myshopify.com/collections/dress/products/1077,https://cdn.shopify.com/s/files/1/0370/4861/5048/products/6e09d4d0-6724-4c97-82e1-f2890a897bdd1560169210558-DOROTHY-PERKINS-Women-Dresses-9621560169208887-1.jpg?v=1586241071,Netcore,Dresses,dress,midi,red,polka,Comfortable
78,Women White Printed Fit and Flare Dress,"Embrace feminine charm with the Women White Printed Fit and Flare Dress. The delicate white color and elegant print, along with the flattering fit and flare silhouette, create a timeless and versatile dress for various occasions.",in stock,new,46 USD,https://netcoredemo.myshopify.com/collections/dress/products/1078,https://cdn.shopify.com/s/files/1/0370/4861/5048/products/55d93d26-62ea-49b6-a1f4-d7e9cec6f1d61550879931089-1.jpg?v=1586241084,Netcore,Dresses,dress,midi,white,polka,Comfortable
79,Taking Shortcuts Dress In Blue Polka,Add a touch of retro flair with the Taking Shortcuts Dress in Blue Polka. The classic blue color and charming polka dot print create a vintage-inspired look that's perfect for a cute and feminine style.,in stock,new,60 USD,https://netcoredemo.myshopify.com/collections/dress/products/1079,https://cdn.shopify.com/s/files/1/0370/4861/5048/products/tntaking_shortcuts_dress_in_blue_polka.jpg?v=1586241086,Netcore,Dresses,dress,midi,blue,polka,slit
80,Taking Shortcuts Dress In Cream Spot,Embrace a playful and stylish look with the Taking Shortcuts Dress in Cream Spot. The cream color and adorable spot print create a fun and versatile dress that's perfect for a variety of casual outings and daytime events.,in stock,new,60 USD,https://netcoredemo.myshopify.com/collections/dress/products/1080,https://cdn.shopify.com/s/files/1/0370/4861/5048/products/taking_shortcuts_dress_in_white_spot_2.jpg?v=1586241088,Netcore,Dresses,dress,midi,white,polka,slit
81,Best Game Dress In Red Spot,Step up your style game with the Best Game Dress in Red Spot. The vibrant red color and playful spot print combine to create a bold and eye-catching dress that's perfect for making a fashion statement.,in stock,new,54 USD,https://netcoredemo.myshopify.com/collections/dress/products/1081,https://cdn.shopify.com/s/files/1/0370/4861/5048/products/best_game_dress_in_red_spot_4.jpg?v=1586241091,Netcore,Dresses,dress,midi,red,polka,slit
82,Feeling It Now Dress In Black Spot,Feel confident and chic with the Feeling It Now Dress in Black Spot. The timeless black color and charming spot print create a versatile and stylish dress that's perfect for both casual and dressier occasions.,in stock,new,65 USD,https://netcoredemo.myshopify.com/collections/dress/products/1082,https://cdn.shopify.com/s/files/1/0370/4861/5048/products/feeling_it_now_dress_in_black_spot_2.jpg?v=1586241093,Netcore,Dresses,dress,midi,black,polka,slit
83,Women Bodycon Black Dress,Flaunt your curves with confidence in the Women Bodycon Black Dress. The sleek black color and form-fitting silhouette create a sexy and sophisticated look that's perfect for a night out or a special event.,in stock,new,11 USD,https://netcoredemo.myshopify.com/collections/dress/products/1083,https://cdn.shopify.com/s/files/1/0370/4861/5048/products/l-mddr836-magnetic-designs-original-imaf5chrfthfvqek.jpg?v=1586241095,Netcore,Dresses,dress,midi,black,polka,tight
84,Women Bodycon White Dress,Embrace elegance with the Women Bodycon White Dress. The crisp white color and figure-hugging silhouette create a sophisticated and timeless look that's perfect for both formal and semi-formal occasions.,in stock,new,75 USD,https://netcoredemo.myshopify.com/collections/dress/products/1084,https://cdn.shopify.com/s/files/1/0370/4861/5048/products/xxl-rk032-needle-works-original-imafnutuawsheawr.jpg?v=1586241096,Netcore,Dresses,dress,midi,white,polka,tight
85,Women Bodycon Pink Dress,"Add a pop of color to your wardrobe with the Women Bodycon Pink Dress. The vibrant pink hue and flattering bodycon fit create a feminine and stylish dress that's perfect for parties, nights out, or special occasions.",in stock,new,54 USD,https://netcoredemo.myshopify.com/collections/dress/products/1085,https://cdn.shopify.com/s/files/1/0370/4861/5048/products/xl-ik-011-ikra-fashion-original-imafhgm7yfsnr5hd.jpg?v=1586241098,Netcore,Dresses,dress,midi,blue,polka,tight
86,Best Fake Smile Dress In Black Spot,Make a statement with the Best Fake Smile Dress in Black Spot. The combination of the classic black color and playful spot print creates a bold and fashionable dress that's perfect for expressing your unique style.,in stock,new,65 USD,https://netcoredemo.myshopify.com/collections/dress/products/1086,https://cdn.shopify.com/s/files/1/0370/4861/5048/products/robest_fake_smile_dress_in_black_spot.jpg?v=1586241101,Netcore,Dresses,dress,mini,black,polka,tight
87,Black Printed Bodycon Dress,Embrace a sleek and stylish look with the Black Printed Bodycon Dress. The black color and eye-catching print combine to create a sophisticated and versatile dress that's perfect for various occasions.,in stock,new,81 USD,https://netcoredemo.myshopify.com/collections/dress/products/1087,https://cdn.shopify.com/s/files/1/0370/4861/5048/products/FabAlley-Black-Printed-Bodycon-Dress_1_f0d53ba22c8eff280ab496bbdd139e10.jpg?v=1586241102,Netcore,Dresses,dress,mini,black,polka,tight
88,Women Maroon Printed Bodycon Dress,"Stand out with the Women Maroon Printed Bodycon Dress. The rich maroon color and intricate print create a captivating look that's perfect for making a statement at parties, events, or a night out on the town.",in stock,new,89 USD,https://netcoredemo.myshopify.com/collections/dress/products/1088,https://cdn.shopify.com/s/files/1/0370/4861/5048/products/cd5e2bea-fd45-472b-9827-5b079aaf4ca51555526944769-2.jpg?v=1586241104,Netcore,Dresses,dress,mini,red,polka,tight
89,Worlds Away Dress In Black Polka,Channel vintage vibes with the Worlds Away Dress in Black Polka. The black color and charming polka dot print create a timeless and feminine look that's perfect for both casual outings and dressier occasions.,in stock,new,55 USD,https://netcoredemo.myshopify.com/collections/dress/products/1089,https://cdn.shopify.com/s/files/1/0370/4861/5048/products/roworlds_away_dress_in_black_polk.jpg?v=1586241107,Netcore,Dresses,dress,mini,black,polka,Comfortable
90,Women Navy Blue Fit and Flare Dress,Embrace a classic and flattering silhouette with the Women Navy Blue Fit and Flare Dress. The deep navy blue color and timeless fit and flare design create a versatile and elegant dress that's perfect for various events.,in stock,new,79 USD,https://netcoredemo.myshopify.com/collections/dress/products/1090,https://cdn.shopify.com/s/files/1/0370/4861/5048/products/e9651dd3-554a-430c-b2b2-efb8c723a3721562747270736-Ginger-by-Lifestyle-Women-Dresses-6801562747270017-1.jpg?v=1586241108,Netcore,Dresses,dress,mini,blue,polka,Comfortable
91,Women Black Printed Fit and Flare Dress,"Add a touch of elegance to your wardrobe with the Women Black Printed Fit and Flare Dress. The black color and sophisticated print, along with the flattering fit and flare silhouette, create a chic and versatile dress for any occasion.",in stock,new,12 USD,https://netcoredemo.myshopify.com/collections/dress/products/1091,https://cdn.shopify.com/s/files/1/0370/4861/5048/products/1a9da8ee-49b3-4e23-84f6-f9f7690c273c1538378500980-Honey-by-Pantaloons-Womens-Dresses-2621538378500724-1.jpg?v=1586241109,Netcore,Dresses,dress,mini,black,polka,Comfortable
92,Pretty As You Dress In Emerald Spot,Embrace a playful and stylish look with the Pretty As You Dress in Emerald Spot. The vibrant emerald color and charming spot print create a fun and eye-catching dress that's perfect for adding a pop of color to your wardrobe.,in stock,new,65 USD,https://netcoredemo.myshopify.com/collections/dress/products/1092,https://cdn.shopify.com/s/files/1/0370/4861/5048/products/pretty_as_you_dress_in_teal_spot_tn.jpg?v=1586241112,Netcore,Dresses,dress,mini,green,polka,Comfortable
93,Women's Casual Summer Strapless Sexy Polka Dots Party Mini Slit Dress,"Step into summer with the Women's Casual Summer Strapless Sexy Polka Dots Party Mini Slit Dress. The playful polka dot print, strapless design, and mini slit detail create a fun and flirty dress that's perfect for warm-weather occasions.",in stock,new,8 USD,https://netcoredemo.myshopify.com/collections/dress/products/1093,https://cdn.shopify.com/s/files/1/0370/4861/5048/products/610_2BssdRQHL._SX385._SX._UX._SY._UY.jpg?v=1586241114,Netcore,Dresses,dress,mini,white,polka,slit
94,Lovor Women's Wrap Deep V Neck Spaghetti Straps Polka Dots Sleeveless Party Dress Split Beach Casual Belt Mini Dresses,"Embrace a versatile and trendy style with the Lovor Women's Wrap Dress. The deep V-neckline, spaghetti straps, polka dot print, and waist belt detail create a fashionable and feminine dress that's perfect for various occasions.",in stock,new,7 USD,https://netcoredemo.myshopify.com/collections/dress/products/1094,https://cdn.shopify.com/s/files/1/0370/4861/5048/products/615nJ7zfqrL._UX569.jpg?v=1586241115,Netcore,Dresses,dress,mini,red,polka,slit
95,NACY Women's V Neck Wrap Bandage Polka Dot Print Party Midi Bodycon Dress,"Make a fashion statement with the NACY Women's V Neck Wrap Bandage Polka Dot Print Party Midi Bodycon Dress. The combination of the V-neckline, wrap design, bandage detailing, and polka dot print creates a sexy and stylish dress for parties and special events.",in stock,new,14 USD,https://netcoredemo.myshopify.com/collections/dress/products/1095,https://cdn.shopify.com/s/files/1/0370/4861/5048/products/61DKiKyikbL._SX342._SX._UX._SY._UY.jpg?v=1586241116,Netcore,Dresses,dress,mini,yellow,polka,slit
96,VELJIE Womens Cowl Neck Printed Wear to Work Party Dresses,"Embrace a sophisticated and chic look with the VELJIE Womens Cowl Neck Printed Dress. The cowl neck design, stylish print, and versatile style make it a perfect choice for both work and parties, allowing you to effortlessly transition from day to night.",in stock,new,24 USD,https://netcoredemo.myshopify.com/collections/dress/products/1096,https://cdn.shopify.com/s/files/1/0370/4861/5048/products/71pNGf7OJPL._UY606.jpg?v=1586241118,Netcore,Dresses,dress,midi,blue,polka,tight
97,Women Burgundy & White Printed Wrap Dress,"Wrap yourself in style with the Women Burgundy & White Printed Wrap Dress. The elegant burgundy and white print, combined with the flattering wrap silhouette, create a chic and feminine dress that's perfect for any occasion.",in stock,new,13 USD,https://netcoredemo.myshopify.com/collections/dress/products/1097,https://cdn.shopify.com/s/files/1/0370/4861/5048/products/3fe1e1ce-d372-4615-a6fb-55a2f8692ab41573194312273-1.jpg?v=1586241119,Netcore,Dresses,dress,midi,red,polka,Comfortable
98,Miessial Women's Summer Chiffon V Neck Ruffle Maxi Dress Polka Dot Long Beach Wrap Dress,"Embrace the carefree vibes of summer with the Miessial Women's Summer Chiffon V Neck Ruffle Maxi Dress. The breezy chiffon fabric, V-neckline, ruffle detailing, and polka dot print create a stunning and versatile dress for beach vacations or casual outings.",in stock,new,30 USD,https://netcoredemo.myshopify.com/collections/dress/products/1098,https://cdn.shopify.com/s/files/1/0370/4861/5048/products/713VTqizTKL._UY606.jpg?v=1586241120,Netcore,Dresses,dress,maxi,white,polka,slit
99,Women Mustard Yellow Printed Mini Bodycon Dress,Stand out with the Women Mustard Yellow Printed Mini Bodycon Dress. The vibrant mustard yellow color and eye-catching print create a bold and stylish dress that's perfect for making a statement at parties or a night out on the town.,in stock,new,94 USD,https://netcoredemo.myshopify.com/collections/dress/products/1099,https://cdn.shopify.com/s/files/1/0370/4861/5048/products/af820b3b-b2ca-4db1-818c-94f8c0ff077f1531480285256-FOREVER-21-Women-Dresses-6101531480285096-3.jpg?v=1586241122,Netcore,Dresses,dress,mini,yellow,floral,tight
100,Women Yellow & Green Printed Straight Kurta,"Embrace a fusion of tradition and contemporary style with the Women Yellow & Green Printed Straight Kurta. The combination of the vibrant yellow and green print, along with the straight silhouette, create a versatile and fashionable kurta for various occasions.",in stock,new,69 USD,https://netcoredemo.myshopify.com/collections/tops/products/1100,https://cdn.shopify.com/s/files/1/0370/4861/5048/products/5d6a8e02-0fa0-4770-82f5-6b52d9c983561548242338312-Varanga-mustard-printed-straight-kurta-6361548242336928-1.jpg?v=1586241124,Netcore,Shirts,Tops,,yellow,floral,
101,Women Navy Blue & Off-White Printed A-Line Kurta,Elevate your ethnic wardrobe with the Women Navy Blue & Off-White Printed A-Line Kurta. The navy blue and off-white print create a stylish and versatile kurta that's perfect for both casual and festive occasions.,in stock,new,55 USD,https://netcoredemo.myshopify.com/collections/tops/products/1101,https://cdn.shopify.com/s/files/1/0370/4861/5048/products/5866fc9e-ae67-4134-ae76-ab8731b443ac1558954938814-Indo-Era-Navy-Blue-Printed-Anarkali-Kurtas-2491558954937750-1.jpg?v=1586241125,Netcore,Shirts,Tops,,blue,floral,
102,Women Green & Brown Printed Straight Kurta,"Embrace a fusion of colors with the Women Green & Brown Printed Straight Kurta. The vibrant green and brown print, combined with the straight silhouette, create a trendy and fashionable kurta for various events.",in stock,new,52 USD,https://netcoredemo.myshopify.com/collections/tops/products/1102,https://cdn.shopify.com/s/files/1/0370/4861/5048/products/bf6d1164-4229-4577-9f27-24bbfbd404d61555319879401-Green-Printed-Straight-Kurta-1241555319877321-1.jpg?v=1586241126,Netcore,Shirts,Tops,,green,floral,
103,Women Black & Mustard Yellow Printed Straight Kurta,"Make a statement with the Women Black & Mustard Yellow Printed Straight Kurta. The bold black and mustard yellow print, along with the straight silhouette, create a chic and stylish kurta for a contemporary look.",in stock,new,59 USD,https://netcoredemo.myshopify.com/collections/tops/products/1103,https://cdn.shopify.com/s/files/1/0370/4861/5048/products/f9d5e2fa-808f-4163-9941-f3ab25a3e0e61566823180889-AHIKA-Women-Kurtas-261566823179379-1.jpg?v=1586241128,Netcore,Shirts,Tops,,black,floral,
104,Women Off-White & Pink Printed A-Line Kurta,"Add a touch of femininity with the Women Off-White & Pink Printed A-Line Kurta. The delicate off-white and pink print, combined with the flattering A-line silhouette, create an elegant and timeless kurta for any occasion.",in stock,new,9 USD,https://netcoredemo.myshopify.com/collections/tops/products/1104,https://cdn.shopify.com/s/files/1/0370/4861/5048/products/9a8297fb-5a28-4cda-bcd7-43b2f29ba23b1579823187678-1.jpg?v=1586241129,Netcore,Shirts,Tops,,white,floral,
