id,title,description,availibility,condition,price,link,image_link,BRAND,category,sub-category,length,colour,pattern,fit
105,Women Red Printed Straight Kurta,Stand out with the Women Red Printed Straight Kurta. The vibrant red color and eye-catching print create a bold and stylish kurta that's perfect for making a statement at festive gatherings or special events.,in stock,new,12 USD,https://netcoredemo.myshopify.com/collections/tops/products/1105,https://cdn.shopify.com/s/files/1/0370/4861/5048/products/359fbce6-91eb-43bd-a00f-d66739ca64e01580173067064-1.jpg?v=1586241131,Netcore,Shirts,Tops,,red,floral,
106,Women Lime Green Printed A-Line Kurta,Embrace a fresh and vibrant look with the Women Lime Green Printed A-Line Kurta. The lively lime green color and charming print create a chic and contemporary kurta that's perfect for a modern ethnic style.,in stock,new,11 USD,https://netcoredemo.myshopify.com/collections/tops/products/1106,https://cdn.shopify.com/s/files/1/0370/4861/5048/products/6bad3af3-5a3a-4723-8011-ec663ed401321578303692446-Swishchick-Women-Kurtas-131578303690619-1.jpg?v=1586241132,Netcore,Shirts,Tops,,green,floral,
107,Women Black & Green Printed Straight Kurta,Channel elegance with the Women Black & Green Printed Straight Kurta. The classic black color and subtle green print create a sophisticated and versatile kurta that's perfect for both casual and formal occasions.,in stock,new,59 USD,https://netcoredemo.myshopify.com/collections/tops/products/1107,https://cdn.shopify.com/s/files/1/0370/4861/5048/products/30b0017d-7e72-4d40-9633-ef78d01719741575541717470-AHIKA-Women-Black--Green-Printed-Straight-Kurta-990157554171-1.jpg?v=1586241134,Netcore,Shirts,Tops,,black,floral,
108,Women Black Solid Straight Kurta,Embrace simplicity and versatility with the Women Black Solid Straight Kurta. The timeless black color and straight silhouette create a classic and elegant kurta that can be dressed up or down for various occasions.,in stock,new,12 USD,https://netcoredemo.myshopify.com/collections/tops/products/1108,https://cdn.shopify.com/s/files/1/0370/4861/5048/products/15daf217-9675-44eb-9a72-a1fa5c0e59ac1580992868021-IMARA-Women-Black-Solid-Straight-Kurta-6641580992866573-1.jpg?v=1586241135,Netcore,Shirts,Tops,,black,solid,
109,Women Navy Blue Solid Straight Kurta,Add a staple piece to your wardrobe with the Women Navy Blue Solid Straight Kurta. The deep navy blue color and clean-cut silhouette create a versatile and timeless kurta that can be styled for both casual and formal looks.,in stock,new,89 USD,https://netcoredemo.myshopify.com/collections/tops/products/1109,https://cdn.shopify.com/s/files/1/0370/4861/5048/products/4cb2e018-0cf5-499c-aeb2-2537073ad1b71581332992348-AURELIA-Women-Navy-Blue-Solid-Straight-Kurta-598158133299082-1.jpg?v=1586241136,Netcore,Shirts,Tops,,blue,solid,
110,Women Red Solid Straight Kurta,"Make a bold statement with the Women Red Solid Straight Kurta. The vibrant red color and clean design create a confident and stylish kurta that's perfect for festive occasions, parties, or a touch of glamour in your daily wear.",in stock,new,12 USD,https://netcoredemo.myshopify.com/collections/tops/products/1110,https://cdn.shopify.com/s/files/1/0370/4861/5048/products/0e1eb1b6-6e1d-4652-bf16-04ae41aaca8c1580991972019-IMARA-Women-Red-Solid-Straight-Kurta-6381580991970076-1.jpg?v=1586241138,Netcore,Shirts,Tops,,red,solid,
111,Women Olive Green Solid Pathani Kurta,Embrace a traditional and versatile style with the Women Olive Green Solid Pathani Kurta. The rich olive green color and Pathani-inspired design create a classic and ethnic kurta that's perfect for cultural events or festive celebrations.,in stock,new,51 USD,https://netcoredemo.myshopify.com/collections/tops/products/1111,https://cdn.shopify.com/s/files/1/0370/4861/5048/products/11504603353413-Libas-Women-Kurtas-1081504603353246-1.jpg?v=1586241139,Netcore,Shirts,Tops,,green,solid,
112,Women Yellow Solid Straight Kurta,Add a pop of color to your wardrobe with the Women Yellow Solid Straight Kurta. The vibrant yellow hue and clean-cut silhouette create a fresh and stylish kurta that's perfect for both casual and semi-formal occasions.,in stock,new,12 USD,https://netcoredemo.myshopify.com/collections/tops/products/1112,https://cdn.shopify.com/s/files/1/0370/4861/5048/products/d1f50810-2dc0-4573-8498-2be2ef72bf8e1581029192537-1.jpg?v=1586241140,Netcore,Shirts,Tops,,yellow,solid,
113,Women White Solid Straight Kurta,Embrace elegance with the Women White Solid Straight Kurta. The crisp white color and clean design create a sophisticated and versatile kurta that's perfect for both formal events and everyday wear.,in stock,new,51 USD,https://netcoredemo.myshopify.com/collections/tops/products/1113,https://cdn.shopify.com/s/files/1/0370/4861/5048/products/906e1263-6f5d-417e-89c1-48efadf56adb1554100726968-SASSAFRAS-Women-White-Solid-Straight-Kurta-5101554100725907-1.jpg?v=1586241142,Netcore,Shirts,Tops,,white,solid,
114,Women White Solid A-Line Kurta,Step into timeless style with the Women White Solid A-Line Kurta. The pristine white color and flattering A-line silhouette create a chic and versatile kurta that can be dressed up or down for various occasions.,in stock,new,24 USD,https://netcoredemo.myshopify.com/collections/tops/products/1114,https://cdn.shopify.com/s/files/1/0370/4861/5048/products/35515912-1a21-4cc8-8f78-7c58340cbab71581471500707-1.jpg?v=1586241144,Netcore,Shirts,Tops,,white,solid,
115,Women Blue Solid A-Line Kurta,Elevate your ethnic wardrobe with the Women Blue Solid A-Line Kurta. The rich blue color and flattering A-line silhouette create a stylish and versatile kurta that's perfect for both casual and festive occasions.,in stock,new,14 USD,https://netcoredemo.myshopify.com/collections/tops/products/1115,https://cdn.shopify.com/s/files/1/0370/4861/5048/products/430b3360-84a3-4771-b326-3554ad4fda511581924904985-Embroidered-Straight-Kurta-3131581924903475-1.jpg?v=1586241145,Netcore,Shirts,Tops,,blue,solid,
116,Women Maroon Solid Straight Kurta,Embrace a rich and elegant look with the Women Maroon Solid Straight Kurta. The deep maroon color and clean-cut silhouette create a sophisticated and versatile kurta that's perfect for both formal and festive events.,in stock,new,15 USD,https://netcoredemo.myshopify.com/collections/tops/products/1116,https://cdn.shopify.com/s/files/1/0370/4861/5048/products/72077f26-9654-415c-875b-4322b0e28e701580451419626-W-Women-Maroon-Solid-Straight-Kurta-3921580451418709-1.jpg?v=1586241147,Netcore,Shirts,Tops,,red,solid,
117,Women Black & White Polka Dot Print Anarkali Kurta,"Embrace a playful and retro-inspired style with the Women Black & White Polka Dot Print Anarkali Kurta. The classic black and white polka dot print, along with the flared silhouette, create a charming and feminine kurta for special occasions.",in stock,new,94 USD,https://netcoredemo.myshopify.com/collections/tops/products/1117,https://cdn.shopify.com/s/files/1/0370/4861/5048/products/6b3e107d-fa61-4d59-8c86-9b4aa9dd67741568379867502-MBE-Women-Black--White-Printed-Anarkali-Kurta-61515683798657-1.jpg?v=1586241149,Netcore,Shirts,Tops,,black,polka,
118,Women Polka Print Polyester Ethnic Dress (Green),Add a touch of retro charm with the Women Polka Print Polyester Ethnic Dress in Green. The vibrant green color and timeless polka dot print create a playful and stylish dress that's perfect for festive celebrations or casual outings.,in stock,new,71 USD,https://netcoredemo.myshopify.com/collections/tops/products/1118,https://cdn.shopify.com/s/files/1/0370/4861/5048/products/l-8497mj-green-libas-original-imafjgvsfw2mskyw.jpg?v=1586241151,Netcore,Shirts,Tops,,green,polka,
119,Women Polka Print Cotton Rayon Blend Flared Kurta (Blue),"Embrace a blend of comfort and style with the Women Polka Print Cotton Rayon Blend Flared Kurta in Blue. The blue color and flared silhouette, along with the polka dot print, create a chic and versatile kurta for a trendy ethnic look.",in stock,new,71 USD,https://netcoredemo.myshopify.com/collections/tops/products/1119,https://cdn.shopify.com/s/files/1/0370/4861/5048/products/l-dv103blu-divastri-original-imaf96zapzzpkcap.jpg?v=1586241152,Netcore,Shirts,Tops,,blue,polka,
120,Women Polka Print Pure Cotton A-line Kurti (Red),"Step into timeless elegance with the Women Polka Print Pure Cotton A-line Kurti in Red. The classic red color and A-line silhouette, along with the polka dot print, create a versatile and feminine kurta that's perfect for various occasions.",in stock,new,69 USD,https://netcoredemo.myshopify.com/collections/tops/products/1120,https://cdn.shopify.com/s/files/1/0370/4861/5048/products/s-nck440-s-sanu-fashion-original-imafgwhfwezvsbhu.jpg?v=1586241154,Netcore,Shirts,Tops,,red,polka,
121,Women Polka Print Cambric Flared Kurta (Yellow),"Embrace a cheerful and fashionable look with the Women Polka Print Cambric Flared Kurta in Yellow. The vibrant yellow color and flared silhouette, along with the polka dot print, create a playful and trendy kurta for casual outings or festive events.",in stock,new,67 USD,https://netcoredemo.myshopify.com/collections/tops/products/1121,https://cdn.shopify.com/s/files/1/0370/4861/5048/products/s-ss10-rustorange-original-imafjaxfctvhssqd.jpg?v=1586241156,Netcore,Shirts,Tops,,yellow,polka,
122,"Women's Polka Print Rayon Anarkali Kurta (White, Brown)","Add a touch of elegance with the Women's Polka Print Rayon Anarkali Kurta in White and Brown. The classic combination of white and brown, along with the polka dot print and Anarkali silhouette, create a graceful and stylish kurta for special occasions.",in stock,new,10 USD,https://netcoredemo.myshopify.com/collections/tops/products/1122,https://cdn.shopify.com/s/files/1/0370/4861/5048/products/3xl-126browna3xl-lee-moda-original-imafnhgwt8hgchrs.jpg?v=1586241158,Netcore,Shirts,Tops,,white,polka,
123,Women Polka Print Pure Cotton A-line Kurti (Black),"Embrace a classic and versatile look with the Women Polka Print Pure Cotton A-line Kurti in Black. The timeless black color and A-line silhouette, along with the polka dot print, create a chic and stylish kurta that can be dressed up or down.",in stock,new,59 USD,https://netcoredemo.myshopify.com/collections/tops/products/1123,https://cdn.shopify.com/s/files/1/0370/4861/5048/products/l-nck438-l-sanu-fashion-original-imafjf9yytnhh8sa.jpg?v=1586241160,Netcore,Shirts,Tops,,black,polka,
124,"Women Polka Print Cotton Blend Straight Kurta (White, Yellow)","Add a playful twist to your ethnic wardrobe with the Women Polka Print Cotton Blend Straight Kurta in White and Yellow. The combination of white and yellow, along with the polka dot print, create a vibrant and trendy kurta for various occasions.",in stock,new,53 USD,https://netcoredemo.myshopify.com/collections/tops/products/1124,https://cdn.shopify.com/s/files/1/0370/4861/5048/products/l-110050077yellow-rangmanch-by-pantaloons-original-imafc5cjnqpxj4kt.jpg?v=1586241161,Netcore,Shirts,Tops,,yellow,polka,
125,Stress Free Top In Sage Floral,Embrace comfort and style with the Stress Free Top in Sage Floral. The soft sage color and delicate floral pattern create a relaxed and feminine top that's perfect for casual outings or lounging at home.,in stock,new,19 USD,https://netcoredemo.myshopify.com/collections/tops/products/1125,https://cdn.shopify.com/s/files/1/0370/4861/5048/products/tnstress_free_top_in_green_floral.jpg?v=1586241164,Netcore,Shirts,Tops,,blue,floral,
126,Guidance Top In Navy Floral,Channel elegance with the Guidance Top in Navy Floral. The deep navy color and intricate floral print create a sophisticated and stylish top that can be dressed up or down for both formal and casual occasions.,in stock,new,14 USD,https://netcoredemo.myshopify.com/collections/tops/products/1126,https://cdn.shopify.com/s/files/1/0370/4861/5048/products/guidance_top_in_navy_floral_tn.jpg?v=1586241167,Netcore,Shirts,Tops,,blue,floral,
127,Minor Mistake Top In Green Floral,Embrace a fresh and vibrant look with the Minor Mistake Top in Green Floral. The lively green color and playful floral pattern create a chic and trendy top that's perfect for adding a pop of color to your outfit.,in stock,new,21 USD,https://netcoredemo.myshopify.com/collections/tops/products/1127,https://cdn.shopify.com/s/files/1/0370/4861/5048/products/tn_minor_mistake_top_in_green_flora.jpg?v=1586241170,Netcore,Shirts,Tops,,green,floral,
128,Iconic Girl Top In Black Floral,Make a statement with the Iconic Girl Top in Black Floral. The bold black color and eye-catching floral print create a stylish and confident top that's perfect for both casual and dressier occasions.,in stock,new,28 USD,https://netcoredemo.myshopify.com/collections/tops/products/1128,https://cdn.shopify.com/s/files/1/0370/4861/5048/products/tniconic_girl_top_in_black_floral.jpg?v=1586241173,Netcore,Shirts,Tops,,black,floral,
129,Iconic Girl Top In Cream Floral,Embrace femininity with the Iconic Girl Top in Cream Floral. The creamy white color and delicate floral print create a graceful and versatile top that can be dressed up or down for various occasions.,in stock,new,23 USD,https://netcoredemo.myshopify.com/collections/tops/products/1129,https://cdn.shopify.com/s/files/1/0370/4861/5048/products/tniconic_girl_top_in_cream_flora.jpg?v=1586241187,Netcore,Shirts,Tops,,white,floral,
130,My Priority Top In Mustard Floral,Add a touch of vibrancy with the My Priority Top in Mustard Floral. The warm mustard color and lively floral pattern create a chic and trendy top that's perfect for both casual and semi-formal outings.,in stock,new,26 USD,https://netcoredemo.myshopify.com/collections/tops/products/1130,https://cdn.shopify.com/s/files/1/0370/4861/5048/products/2019.10.31_28.jpg?v=1586241190,Netcore,Shirts,Tops,,yellow,floral,
131,Stem Top In White Floral,Embrace simplicity and elegance with the Stem Top in White Floral. The clean white color and subtle floral print create a versatile and timeless top that can be styled in numerous ways for different occasions.,in stock,new,15 USD,https://netcoredemo.myshopify.com/collections/tops/products/1131,https://cdn.shopify.com/s/files/1/0370/4861/5048/products/tn_-_crop_above_knee_smooth_wrinkles_near_crotch_stem_top_in_white_flo.jpg?v=1586241193,Netcore,Shirts,Tops,,white,floral,
132,Wanna Be Found Top In Black Floral,Stand out with the Wanna Be Found Top in Black Floral. The striking black color and eye-catching floral print create a bold and stylish top that's perfect for making a statement at any occasion.,in stock,new,19 USD,https://netcoredemo.myshopify.com/collections/tops/products/1132,https://cdn.shopify.com/s/files/1/0370/4861/5048/products/wanna_be_found_top_in_black_floral_3.jpg?v=1586241196,Netcore,Shirts,Tops,,black,floral,
133,Women Mustard Yellow Solid Top,Add a pop of color to your outfit with the Women Mustard Yellow Solid Top. The vibrant mustard yellow hue and clean design create a fresh and versatile top that's perfect for both casual and semi-formal looks.,in stock,new,17 USD,https://netcoredemo.myshopify.com/collections/tops/products/1133,https://cdn.shopify.com/s/files/1/0370/4861/5048/products/80035566-29a1-424c-ba7e-0ee1976b9e001568086051288-DOROTHY-PERKINS-Women-Tops-6091568086050172-1.jpg?v=1586241197,Netcore,Shirts,Tops,,yellow,solid,
134,Women Black Solid Regular Top,Embrace simplicity with the Women Black Solid Regular Top. The classic black color and regular fit create a timeless and versatile top that can be paired with various bottoms for different occasions and styles.,in stock,new,83 USD,https://netcoredemo.myshopify.com/collections/tops/products/1134,https://cdn.shopify.com/s/files/1/0370/4861/5048/products/315d9c31-15cb-44d3-a9b5-d0ad8c56c4461578571030056-DressBerry-Women-Black-Solid-Top-5721578571028502-1.jpg?v=1586241199,Netcore,Shirts,Tops,,black,solid,
135,Women White Solid Top,Step into elegance with the Women White Solid Top. The pristine white color and clean design create a sophisticated and versatile top that's perfect for both casual and formal ensembles.,in stock,new,43 USD,https://netcoredemo.myshopify.com/collections/tops/products/1135,https://cdn.shopify.com/s/files/1/0370/4861/5048/products/11490082997881-Roadster-Women-White-Solid-Regular-Top-9621490082997662-1.jpg?v=1586241200,Netcore,Shirts,Tops,,white,solid,
136,Women Green Ruffled Shirt Style Top,Embrace a playful and feminine look with the Women Green Ruffled Shirt Style Top. The refreshing green color and charming ruffled details create a stylish and trendy top that's perfect for adding flair to your outfits.,in stock,new,46 USD,https://netcoredemo.myshopify.com/collections/tops/products/1136,https://cdn.shopify.com/s/files/1/0370/4861/5048/products/fb86e884-dbdc-4951-bb45-38cc400c437f1554985706259-SASSAFRAS-Women-Olive-Green-Regular-Fit-Solid-Casual-Shirt-3-1.jpg?v=1586241202,Netcore,Shirts,Tops,,green,solid,
137,Women Olive Green Shirt Style Top,Channel a chic and contemporary look with the Women Olive Green Shirt Style Top. The rich olive green color and shirt-style design create a versatile and fashionable top that can be dressed up or down for various occasions.,in stock,new,59 USD,https://netcoredemo.myshopify.com/collections/tops/products/1137,https://cdn.shopify.com/s/files/1/0370/4861/5048/products/11492683630293-Roadster-Women-Olive-Solid-Shirt-Style-Top-7301492683630043-1.jpg?v=1586241203,Netcore,Shirts,Tops,,green,solid,
138,Women Teal Blue Self-Design Top,Make a fashion statement with the Women Teal Blue Self-Design Top. The captivating teal blue color and intricate self-design create a unique and stylish top that's perfect for expressing your individuality and flair.,in stock,new,10 USD,https://netcoredemo.myshopify.com/collections/tops/products/1138,https://cdn.shopify.com/s/files/1/0370/4861/5048/products/2de27516-bc8a-4c19-8929-a523639f27a81580885316722-Roadster-Women-Teal-Solid-Top-2061580885315326-1.jpg?v=1586241205,Netcore,Shirts,Tops,,blue,solid,
139,Women Burgundy Solid Top,Add a touch of sophistication with the Women Burgundy Solid Top. The deep burgundy color and clean design create a classic and elegant top that can be dressed up or down for various occasions and styles.,in stock,new,34 USD,https://netcoredemo.myshopify.com/collections/tops/products/1139,https://cdn.shopify.com/s/files/1/0370/4861/5048/products/d9d235f1-950a-47ed-95c5-5da2922c09561559393674575-Roadster-Women-Maroon-Solid-Top-6411559393673700-1.jpg?v=1586241206,Netcore,Shirts,Tops,,red,solid,
140,Women Maroon Solid Bardot Top,Embrace a feminine and trendy look with the Women Maroon Solid Bardot Top. The rich maroon color and off-shoulder bardot style create a stylish and versatile top that's perfect for both casual and dressier outfits.,in stock,new,51 USD,https://netcoredemo.myshopify.com/collections/tops/products/1140,https://cdn.shopify.com/s/files/1/0370/4861/5048/products/edf50484-83fc-414d-8563-f4462687981b1549003303097-Harpa-Women-Maroon-Solid-Bardot-Top-1111549003302968-1.jpg?v=1586241208,Netcore,Shirts,Tops,,red,solid,
141,Women White Solid Fitted Top,Embrace simplicity and versatility with the Women White Solid Fitted Top. The clean white color and fitted silhouette create a timeless and chic look.,in stock,new,58 USD,https://netcoredemo.myshopify.com/collections/tops/products/1141,https://cdn.shopify.com/s/files/1/0370/4861/5048/products/cbca6b3e-f7ff-4c18-9796-00f8852343981538644149060-Veni-Vidi-Vici-Women-Tops-4231538644148774-1.jpg?v=1586241209,Netcore,Shirts,Tops,,white,solid,
142,Women Mustard Yellow Printed Wrap Top,Add a pop of color to your outfit with the Women Mustard Yellow Printed Wrap Top. The vibrant yellow hue and stylish wrap design create a trendy look.,in stock,new,47 USD,https://netcoredemo.myshopify.com/collections/tops/products/1142,https://cdn.shopify.com/s/files/1/0370/4861/5048/products/09e033fa-9925-4f5f-b5aa-6aac32307fed1552553406848-Harpa-Women-Tops-4791552553405672-1.jpg?v=1586241210,Netcore,Shirts,Tops,,yellow,polka,
143,Women Black Polka Dot Print Top,Channel retro vibes with the Women Black Polka Dot Print Top. The classic polka dot pattern and black color create a playful and fashionable top.,in stock,new,54 USD,https://netcoredemo.myshopify.com/collections/tops/products/1143,https://cdn.shopify.com/s/files/1/0370/4861/5048/products/11522662991296-Style-Quotient-Women-Tops-4231522662991112-1.jpg?v=1586241212,Netcore,Shirts,Tops,,black,polka,
144,Women Navy Blue Printed Shirt Style Top,Embrace a chic and casual look with the Women Navy Blue Printed Shirt Style Top. The stylish shirt-style design and navy blue print create a trendy vibe.,in stock,new,37 USD,https://netcoredemo.myshopify.com/collections/tops/products/1144,https://cdn.shopify.com/s/files/1/0370/4861/5048/products/cbfd6c80-5f90-4609-9914-758eb38352ab1551955429336-Tokyo-Talkies-Women-Navy-Blue-Printed-Shirt-Style-Top-547155-1.jpg?v=1586241213,Netcore,Shirts,Tops,,blue,polka,
145,Women Burgundy & Black Polka Dot Print Top,Make a statement with the Women Burgundy & Black Polka Dot Print Top. The contrasting colors and bold polka dot pattern create a stylish and eye-catching look.,in stock,new,13 USD,https://netcoredemo.myshopify.com/collections/tops/products/1145,https://cdn.shopify.com/s/files/1/0370/4861/5048/products/6bfc7196-f9c6-426f-9955-997d451ae2061571383317980-MANGO-Women-Wine-Coloured--Black-Printed-A-Line-Top-60215713-1.jpg?v=1586241215,Netcore,Shirts,Tops,,red,polka,
146,Women Navy & White Polka Dot Print Bardot Top,Embrace a feminine and trendy look with the Women Navy & White Polka Dot Print Bardot Top. The off-shoulder bardot style and polka dot print create a stylish top.,in stock,new,54 USD,https://netcoredemo.myshopify.com/collections/tops/products/1146,https://cdn.shopify.com/s/files/1/0370/4861/5048/products/68f17da3-14a0-4ac2-954e-d31575b72a471571745277286-Style-Quotient-Women-Tops-7391571745275599-1.jpg?v=1586241216,Netcore,Shirts,Tops,,blue,polka,
147,Women Green Printed Styled Back Top,Add a touch of flair to your outfit with the Women Green Printed Styled Back Top. The unique styled back design and vibrant green print create a fashionable look.,in stock,new,89 USD,https://netcoredemo.myshopify.com/collections/tops/products/1147,https://cdn.shopify.com/s/files/1/0370/4861/5048/products/12de80da-a527-4594-945f-b901ececad701580255852711-1.jpg?v=1586241217,Netcore,Shirts,Tops,,green,polka,
148,Off-White Polka Dot Print Top,Embrace a classic and versatile look with the Off-White Polka Dot Print Top. The timeless polka dot pattern and off-white color create a chic and stylish top.,in stock,new,45 USD,https://netcoredemo.myshopify.com/collections/tops/products/1148,https://cdn.shopify.com/s/files/1/0370/4861/5048/products/11460624759013-Harpa-Off-White-Polka-Dot-Print-Top-3391460624758438-1.jpg?v=1586241219,Netcore,Shirts,Tops,,white,polka,
149,Women Mustard Yellow & White Printed Styled Back Top,Make a fashion statement with the Women Mustard Yellow & White Printed Styled Back Top. The stylish back design and vibrant print create a trendy and eye-catching look.,in stock,new,58 USD,https://netcoredemo.myshopify.com/collections/tops/products/1149,https://cdn.shopify.com/s/files/1/0370/4861/5048/products/55b87ee6-8226-4080-8ded-ece17297882f1573045138464-Carlton-London-Women-Tops-421573045136974-1.jpg?v=1586241220,Netcore,Shirts,Tops,,yellow,polka,
150,Women Navy Blue Regular Fit Floral Print Casual Shirt,Embrace a casual and feminine look with the Women Navy Blue Regular Fit Floral Print Casual Shirt. The floral print and relaxed fit create a stylish and comfortable shirt.,in stock,new,17 USD,https://netcoredemo.myshopify.com/collections/tops/products/1150,https://cdn.shopify.com/s/files/1/0370/4861/5048/products/11523698756736-DOROTHY-PERKINS-Women-Tops-7351523698756588-1.jpg?v=1586241221,Netcore,Shirts,Tops,,blue,floral,
151,Women Maroon & White Regular Fit Printed Casual Shirt,"Channel elegance with the Women Maroon & White Regular Fit Printed Casual Shirt. The combination of maroon and white, along with the printed pattern, creates a sophisticated and versatile shirt.",in stock,new,10 USD,https://netcoredemo.myshopify.com/collections/tops/products/1151,https://cdn.shopify.com/s/files/1/0370/4861/5048/products/1aa63a58-fa88-4944-ade1-600c4877026e1560337094845-her-by-invictus-Women-Maroon--White-Regular-Fit-Printed-Casu-1.jpg?v=1586241223,Netcore,Shirts,Tops,,red,floral,
152,Women White Regular Fit Printed Casual Shirt,Add a touch of charm to your outfit with the Women White Regular Fit Printed Casual Shirt. The printed pattern and clean white color create a stylish and versatile shirt.,in stock,new,76 USD,https://netcoredemo.myshopify.com/collections/tops/products/1152,https://cdn.shopify.com/s/files/1/0370/4861/5048/products/bf9e569f-5873-4759-b073-b5eedd505f3e1551075349739-HERENOW-Women-Shirts-5471551075347923-1.jpg?v=1586241224,Netcore,Shirts,Tops,,white,floral,
153,Women Yellow & White Regular Fit Printed Casual Shirt,"Embrace a vibrant and trendy look with the Women Yellow & White Regular Fit Printed Casual Shirt. The combination of yellow and white, along with the printed pattern, creates a fashionable shirt.",in stock,new,11 USD,https://netcoredemo.myshopify.com/collections/tops/products/1153,https://cdn.shopify.com/s/files/1/0370/4861/5048/products/ae7d5a1d-ae22-47d3-bc06-a51af62254d21579676517309-Mast--Harbour-Women-Yellow--White-Regular-Fit-Printed-Casual-1.jpg?v=1586241226,Netcore,Shirts,Tops,,yellow,floral,
