id,title,description,availibility,condition,price,link,image_link,BRAND,category,sub-category,length,colour,pattern,fit
208,Women Black Printed A-Line Maxi Skirt,Step into elegance and sophistication with the Women Black Printed A-Line Maxi Skirt. The black color and printed pattern add a touch of glamour to your outfit.,in stock,new,63 USD,https://netcoredemo.myshopify.com/collections/skirts/products/1208,https://cdn.shopify.com/s/files/1/0370/4861/5048/products/e8325f38-eb25-4337-bb35-4efd9164b2451564061260216-DressBerry-Women-Skirts-5521564061258749-1.jpg?v=1586241326,Netcore,Skirts,skirts,maxi,blue,floral,slit
209,Women Green & Pink Printed Midi A-Line Skirt,"Embrace a feminine and charming look with the Women Green & Pink Printed Midi A-Line Skirt. The combination of green and pink colors, along with the A-line silhouette, creates a stylish and flattering skirt.",in stock,new,51 USD,https://netcoredemo.myshopify.com/collections/skirts/products/1209,https://cdn.shopify.com/s/files/1/0370/4861/5048/products/94637b86-73ea-46b4-81c9-051ea474ff9d1564649006791-DressBerry-Women-Green--Pink-Printed-Midi-A-Line-Skirt-48515-1.jpg?v=1586241327,Netcore,Skirts,skirts,maxi,green,floral,slit
210,Women Coffee Brown & Green Kalamkari Hand Block Print A-Line Skirt with Slit,"Add a touch of traditional charm with the Women Coffee Brown & Green Kalamkari Hand Block Print A-Line Skirt with Slit. The Kalamkari hand block print, coffee brown, and green colors, and the slit detail create a unique and eye-catching skirt.",in stock,new,69 USD,https://netcoredemo.myshopify.com/collections/skirts/products/1210,https://cdn.shopify.com/s/files/1/0370/4861/5048/products/147cf22f-7dbe-419b-9b31-49091d2f90df1562830414486-Taavi-Women-Coffee-Brown--Green-Kalamkari-Hand-Block-Print-A-1.jpg?v=1586241329,Netcore,Skirts,skirts,maxi,black,floral,slit
211,Women Navy Blue & Pink Printed Pencil Skirt,"Channel a sophisticated and chic look with the Women Navy Blue & Pink Printed Pencil Skirt. The navy blue color and pink print add a pop of color to your outfit, while the pencil silhouette creates a flattering and stylish skirt.",in stock,new,63 USD,https://netcoredemo.myshopify.com/collections/skirts/products/1211,https://cdn.shopify.com/s/files/1/0370/4861/5048/products/ad7aa61d-1835-4382-9894-dcc300ea2d4b1535100651106-SASSAFRAS-Women-Skirts-8901535100650950-1.jpg?v=1586241330,Netcore,Skirts,skirts,midi,blue,floral,tight
212,Women Burgundy & White Printed Pencil Skirt,"Make a statement with the Women Burgundy & White Printed Pencil Skirt. The combination of burgundy and white colors, along with the printed pattern, adds a touch of elegance and style to your outfit.",in stock,new,53 USD,https://netcoredemo.myshopify.com/collections/skirts/products/1212,https://cdn.shopify.com/s/files/1/0370/4861/5048/products/e937d855-c5e8-495c-b9a0-ea3131f9f5131535104538837-SASSAFRAS-Women-Skirts-3411535104538687-1.jpg?v=1586241331,Netcore,Skirts,skirts,midi,red,floral,tight
213,Olive Green & Black Camouflage Print Pencil Skirt,"Embrace an edgy and fashionable look with the Olive Green & Black Camouflage Print Pencil Skirt. The camouflage print and pencil silhouette create a bold and trendy skirt, perfect for making a statement.",in stock,new,60 USD,https://netcoredemo.myshopify.com/collections/skirts/products/1213,https://cdn.shopify.com/s/files/1/0370/4861/5048/products/c4eadb30-3d15-467f-b1f4-d09bcd78d3451537854523126-SASSAFRAS-Olive-Green-Camouflage-Printed-Pencil-Skirt-611537854522939-1.jpg?v=1586241332,Netcore,Skirts,skirts,midi,green,floral,tight
214,Summer Resort Skirt In White Floral,"Step into a vacation-ready look with the Summer Resort Skirt In White Floral. The white color and floral print create a fresh and stylish skirt, perfect for summer vibes.",in stock,new,47 USD,https://netcoredemo.myshopify.com/collections/skirts/products/1214,https://cdn.shopify.com/s/files/1/0370/4861/5048/products/rosummer_resort_skirt_in_white_floral.jpg?v=1586241335,Netcore,Skirts,skirts,midi,white,floral,comfortable
215,Always With Me Skirt In Rust Floral,Embrace a bohemian-inspired look with the Always With Me Skirt In Rust Floral. The rust floral print and flowing silhouette create a relaxed and fashionable skirt for any occasion.,in stock,new,33 USD,https://netcoredemo.myshopify.com/collections/skirts/products/1215,https://cdn.shopify.com/s/files/1/0370/4861/5048/products/always_with_me_skirt_in_rust_floral_5.jpg?v=1586241338,Netcore,Skirts,skirts,midi,red,floral,comfortable
216,Meeting Ground Skirt In Sage Floral,Channel a sophisticated and feminine look with the Meeting Ground Skirt In Sage Floral. The sage floral print and elegant design create a stylish and versatile skirt.,in stock,new,29 USD,https://netcoredemo.myshopify.com/collections/skirts/products/1216,https://cdn.shopify.com/s/files/1/0370/4861/5048/products/tn_758.jpg?v=1586241340,Netcore,Skirts,skirts,midi,blue,floral,comfortable
217,The Frenzy Skirt In Wine Floral,"Make a statement with The Frenzy Skirt In Wine Floral. The wine floral print and unique design create a bold and fashionable skirt, perfect for standing out from the crowd.",in stock,new,23 USD,https://netcoredemo.myshopify.com/collections/skirts/products/1217,https://cdn.shopify.com/s/files/1/0370/4861/5048/products/tnthe_frenzy_skirt_in_wine_floral.jpg?v=1586241343,Netcore,Skirts,skirts,midi,red,floral,comfortable
218,She Still Blooms Skirt In Blue Floral,Embrace a romantic and feminine look with the She Still Blooms Skirt In Blue Floral. The blue floral print and flowing silhouette create an elegant and graceful skirt.,in stock,new,50 USD,https://netcoredemo.myshopify.com/collections/skirts/products/1218,https://cdn.shopify.com/s/files/1/0370/4861/5048/products/tn_she_still_blooms_skirt_in_blue_floral.jpg?v=1586241346,Netcore,Skirts,skirts,midi,blue,floral,slit
219,Quiet Moments Skirt In White Floral,Add a touch of charm and elegance with the Quiet Moments Skirt In White Floral. The white floral print and delicate design create a timeless and versatile skirt.,in stock,new,50 USD,https://netcoredemo.myshopify.com/collections/skirts/products/1219,https://cdn.shopify.com/s/files/1/0370/4861/5048/products/tnquiet_moments_skirt_in_white_floral.jpg?v=1586241348,Netcore,Skirts,skirts,midi,white,floral,slit
220,Cinnamon Love Skirt In White Floral,Step into a romantic and stylish look with the Cinnamon Love Skirt In White Floral. The white floral print and flowing silhouette create a feminine and elegant skirt.,in stock,new,50 USD,https://netcoredemo.myshopify.com/collections/skirts/products/1220,https://cdn.shopify.com/s/files/1/0370/4861/5048/products/tncinnamon_love_skirt_in_white_floral.jpg?v=1586241351,Netcore,Skirts,skirts,midi,white,floral,slit
221,Sweet Salvation Skirt In Black Floral,Channel a chic and edgy look with the Sweet Salvation Skirt In Black Floral. The black floral print and unique design add a touch of sophistication and style to your outfit.,in stock,new,28 USD,https://netcoredemo.myshopify.com/collections/skirts/products/1221,https://cdn.shopify.com/s/files/1/0370/4861/5048/products/sweet_salvation_skirt_in_black_floral_tn.jpg?v=1586241354,Netcore,Skirts,skirts,midi,black,floral,slit
222,Puzzle Pieces Skirt In Green Floral,Embrace a playful and trendy look with the Puzzle Pieces Skirt In Green Floral. The green floral print and puzzle pieces design create a fashionable and eye-catching skirt.,in stock,new,35 USD,https://netcoredemo.myshopify.com/collections/skirts/products/1222,https://cdn.shopify.com/s/files/1/0370/4861/5048/products/ropuzzle_pieces_skirt_in_green_floral.jpg?v=1586241356,Netcore,Skirts,skirts,mini,green,floral,tight
223,Puzzle Pieces Skirt In Red Floral,Make a statement with the Puzzle Pieces Skirt In Red Floral. The red floral print and unique puzzle pieces design add a bold and stylish element to your outfit.,in stock,new,35 USD,https://netcoredemo.myshopify.com/collections/skirts/products/1223,https://cdn.shopify.com/s/files/1/0370/4861/5048/products/tn_puzzle_pieces_skirt_in_red_floral.jpg?v=1586241359,Netcore,Skirts,skirts,mini,red,floral,tight
224,Right Vibes Skirt In Blue Floral,Step into a vibrant and fashionable look with the Right Vibes Skirt In Blue Floral. The blue floral print and flowing silhouette create a playful and trendy skirt.,in stock,new,35 USD,https://netcoredemo.myshopify.com/collections/skirts/products/1224,https://cdn.shopify.com/s/files/1/0370/4861/5048/products/tn_-_right_vibes_skirt_in_blue_floral.jpg?v=1586241363,Netcore,Skirts,skirts,mini,blue,floral,tight
225,White & Blue Printed Pencil Skirt,Channel a classic and stylish look with the White & Blue Printed Pencil Skirt. The white and blue print adds a timeless and elegant touch to this pencil skirt.,in stock,new,44 USD,https://netcoredemo.myshopify.com/collections/skirts/products/1225,https://cdn.shopify.com/s/files/1/0370/4861/5048/products/11486547311981-Campus-Sutra-Women-Skirts-3731486547311740-1.jpg?v=1586241364,Netcore,Skirts,skirts,mini,white,floral,tight
226,Seek Me Out Skirt In Red Print,"Make a statement with the Seek Me Out Skirt In Red Print. The red print and unique design create a bold and eye-catching skirt, perfect for standing out from the crowd.",in stock,new,35 USD,https://netcoredemo.myshopify.com/collections/skirts/products/1226,https://cdn.shopify.com/s/files/1/0370/4861/5048/products/roseek_me_out_skirt_in_red_print.jpg?v=1586241367,Netcore,Skirts,skirts,mini,red,floral,comfortable
227,Seek Me Out Skirt In Green Floral,Embrace a fresh and vibrant look with the Seek Me Out Skirt In Green Floral. The green floral print and flowing silhouette create a playful and fashionable skirt.,in stock,new,35 USD,https://netcoredemo.myshopify.com/collections/skirts/products/1227,https://cdn.shopify.com/s/files/1/0370/4861/5048/products/tn_-_seek_me_out_skirt_in_green_floral.jpg?v=1586241369,Netcore,Skirts,skirts,mini,green,floral,comfortable
229,Seek Me Out Skirt In Black Floral,Channel a chic and stylish look with the Seek Me Out Skirt In Black Floral. The black floral print and unique design add a touch of sophistication and fashion to your outfit.,in stock,new,35 USD,https://netcoredemo.myshopify.com/collections/skirts/products/1229,https://cdn.shopify.com/s/files/1/0370/4861/5048/products/tn_-_seek_me_out_skirt_in_black_floral.jpg?v=1586241375,Netcore,Skirts,skirts,mini,black,floral,comfortable
230,Reinvent Yourself Skirt In Black Floral,Embrace a bold and edgy look with the Reinvent Yourself Skirt In Black Floral. The black floral print and modern design create a trendy and fashionable skirt.,in stock,new,35 USD,https://netcoredemo.myshopify.com/collections/skirts/products/1230,https://cdn.shopify.com/s/files/1/0370/4861/5048/products/tn_-_reinvent_yourself_skirt_in_black_floral.jpg?v=1586241378,Netcore,Skirts,skirts,mini,black,floral,slit
231,Have A Crush Skirt In Lilac Floral,Channel a romantic and whimsical look with the Have A Crush Skirt In Lilac Floral. The lilac floral print and flowing silhouette create a feminine and graceful skirt.,in stock,new,35 USD,https://netcoredemo.myshopify.com/collections/skirts/products/1231,https://cdn.shopify.com/s/files/1/0370/4861/5048/products/ro_-have_a_crush_skirt_in_lilac_floral.jpg?v=1586241381,Netcore,Skirts,skirts,mini,blue,floral,slit
232,Loving Reminder Skirt In White Floral,Step into elegance and charm with the Loving Reminder Skirt In White Floral. The white floral print and delicate design create a timeless and versatile skirt.,in stock,new,35 USD,https://netcoredemo.myshopify.com/collections/skirts/products/1232,https://cdn.shopify.com/s/files/1/0370/4861/5048/products/ro_loving_reminder_skirt_in_white_floral.jpg?v=1586241384,Netcore,Skirts,skirts,mini,white,floral,slit
233,Stop Fighting Skirt In Black Satin,Add a touch of elegance and sophistication with the Stop Fighting Skirt In Black Satin. The black satin fabric and flowing silhouette create a luxurious and stylish skirt.,in stock,new,50 USD,https://netcoredemo.myshopify.com/collections/skirts/products/1233,https://cdn.shopify.com/s/files/1/0370/4861/5048/products/2020.1.16_875.jpg?v=1586241387,Netcore,Skirts,skirts,maxi,black,solid,tight
234,Women Blue Solid Maxi Skirt,Elevate your style with the Women Blue Solid Maxi Skirt. The solid blue color and maxi length create a versatile and fashionable skirt for any occasion.,in stock,new,77 USD,https://netcoredemo.myshopify.com/collections/skirts/products/1234,https://cdn.shopify.com/s/files/1/0370/4861/5048/products/11524647267350-na-4671524647267182-1.jpg?v=1586241389,Netcore,Skirts,skirts,maxi,blue,solid,tight
235,URBAN K Womens Basic Foldable High Waist Regular and Plus Size Maxi Skirts,"Stay comfortable and stylish with the URBAN K Womens Basic Foldable High Waist Regular and Plus Size Maxi Skirts. These maxi skirts feature a foldable high waist and are available in regular and plus sizes, providing a perfect fit for all body types.",in stock,new,18 USD,https://netcoredemo.myshopify.com/collections/skirts/products/1235,https://cdn.shopify.com/s/files/1/0370/4861/5048/products/510LKOVD3IL._SY445._SX._UX._SY._UY.jpg?v=1586241390,Netcore,Skirts,skirts,maxi,red,solid,tight
236,Women Solid Pencil Black Skirt,Channel a sleek and sophisticated look with the Women Solid Pencil Black Skirt. The solid black color and pencil silhouette create a timeless and versatile skirt.,in stock,new,54 USD,https://netcoredemo.myshopify.com/collections/skirts/products/1236,https://cdn.shopify.com/s/files/1/0370/4861/5048/products/free-size-up-to-32-36-cotton-lycra-solid-skirt-long-black-wsb-original-imafc44gevuzqadx.jpg?v=1586241392,Netcore,Skirts,skirts,maxi,black,solid,tight
237,Women Mustard Yellow Solid Maxi Skirt,Embrace a vibrant and stylish look with the Women Mustard Yellow Solid Maxi Skirt. The mustard yellow color and maxi length create a bold and fashionable skirt.,in stock,new,25 USD,https://netcoredemo.myshopify.com/collections/skirts/products/1237,https://cdn.shopify.com/s/files/1/0370/4861/5048/products/64a4f01c-aba1-4764-93a4-c5b08470af501575306894966-1.jpg?v=1586241394,Netcore,Skirts,skirts,maxi,yellow,solid,comfortable
238,Women Green Solid Soft Net Fit & Flared Party Wear Maxi Skirt,"Step into a glamorous and elegant look with the Women Green Solid Soft Net Fit & Flared Party Wear Maxi Skirt. The soft net fabric, fit and flared style, and party wear design create a stunning and eye-catching skirt.",in stock,new,14 USD,https://netcoredemo.myshopify.com/collections/skirts/products/1238,https://cdn.shopify.com/s/files/1/0370/4861/5048/products/add048f7-aca0-4aa4-a7ae-3ed5f726064e1575845833015-1.jpg?v=1586241396,Netcore,Skirts,skirts,maxi,green,solid,comfortable
239,Women Navy-Blue Solid Tiered Maxi Skirt,Embrace a chic and feminine look with the Women Navy-Blue Solid Tiered Maxi Skirt. The tiered design and solid navy-blue color add a touch of elegance and style to your outfit.,in stock,new,11 USD,https://netcoredemo.myshopify.com/collections/skirts/products/1239,https://cdn.shopify.com/s/files/1/0370/4861/5048/products/e1bdfd30-5d43-48e8-a8bb-7cdaaa6d44011567572880438-1.jpg?v=1586241398,Netcore,Skirts,skirts,maxi,blue,solid,comfortable
240,Break The Habit Skirt In White,"Make a statement with the Break The Habit Skirt In White. The white color and unique design create a bold and fashionable skirt, perfect for expressing your individuality.",in stock,new,29 USD,https://netcoredemo.myshopify.com/collections/skirts/products/1240,https://cdn.shopify.com/s/files/1/0370/4861/5048/products/tnbreak_the_habit_skirt_in_white.jpg?v=1586241400,Netcore,Skirts,skirts,maxi,white,solid,slit
241,Westside Story Skirt In Black,Channel a timeless and sophisticated look with the Westside Story Skirt In Black. The black color and classic design create a versatile and elegant skirt.,in stock,new,40 USD,https://netcoredemo.myshopify.com/collections/skirts/products/1241,https://cdn.shopify.com/s/files/1/0370/4861/5048/products/rowestside_story_skirt_in_black.jpg?v=1586241403,Netcore,Skirts,skirts,maxi,black,solid,slit
242,Break The Habit Skirt In Pink,Embrace a playful and feminine look with the Break The Habit Skirt In Pink. The pink color and unique design add a touch of charm and style to your outfit.,in stock,new,45 USD,https://netcoredemo.myshopify.com/collections/skirts/products/1242,https://cdn.shopify.com/s/files/1/0370/4861/5048/products/ro_break_the_habit_skirt_in_pink.jpg?v=1586241406,Netcore,Skirts,skirts,maxi,red,solid,slit
243,ETHER Navy Melange Maxi Skirt,Elevate your style with the ETHER Navy Melange Maxi Skirt. The navy melange color and maxi length create a versatile and fashionable skirt for any occasion.,in stock,new,48 USD,https://netcoredemo.myshopify.com/collections/skirts/products/1243,https://cdn.shopify.com/s/files/1/0370/4861/5048/products/0c319332-6cfe-48fd-ba57-a4d387ac64631548655300136-ETHER-Navy-Melange-Maxi-Skirt-3031548655298712-1.jpg?v=1586241408,Netcore,Skirts,skirts,maxi,blue,solid,slit
244,Missing Merit Skirt In Black Leatherette,Channel an edgy and bold look with the Missing Merit Skirt In Black Leatherette. The black leatherette fabric and unique design create a statement-making skirt.,in stock,new,45 USD,https://netcoredemo.myshopify.com/collections/skirts/products/1244,https://cdn.shopify.com/s/files/1/0370/4861/5048/products/tn_747.jpg?v=1586241410,Netcore,Skirts,skirts,midi,black,solid,tight
245,Mindful Soul Skirt In Wine,"Embrace a bohemian-inspired look with the Mindful Soul Skirt In Wine. The wine color and flowing silhouette create a relaxed and stylish skirt, perfect for expressing your inner free spirit.",in stock,new,50 USD,https://netcoredemo.myshopify.com/collections/skirts/products/1245,https://cdn.shopify.com/s/files/1/0370/4861/5048/products/tnmindful_soul_skirt_in_wine.jpg?v=1586241413,Netcore,Skirts,skirts,midi,red,solid,tight
246,Smooth Talker Skirt In Nude,Step into elegance and sophistication with the Smooth Talker Skirt In Nude. The nude color and sleek design create a chic and versatile skirt for various occasions.,in stock,new,16 USD,https://netcoredemo.myshopify.com/collections/skirts/products/1246,https://cdn.shopify.com/s/files/1/0370/4861/5048/products/tnsmooth_talker_skirt_in_nude.jpg?v=1586241415,Netcore,Skirts,skirts,midi,white,solid,tight
247,Those Goosebumps Skirt In Black,"Make a statement with the Those Goosebumps Skirt In Black. The black color and unique design create a bold and fashionable skirt, perfect for making an impression.",in stock,new,23 USD,https://netcoredemo.myshopify.com/collections/skirts/products/1247,https://cdn.shopify.com/s/files/1/0370/4861/5048/products/tnthose_goosebumps_skirt_in_black.jpg?v=1586241418,Netcore,Skirts,skirts,midi,black,solid,comfortable
248,Mentor Goals Skirt In Dusty Rose,Channel a feminine and graceful look with the Mentor Goals Skirt In Dusty Rose. The dusty rose color and flowing silhouette create an elegant and versatile skirt.,in stock,new,50 USD,https://netcoredemo.myshopify.com/collections/skirts/products/1248,https://cdn.shopify.com/s/files/1/0370/4861/5048/products/mentor_goals_skirt_in_dusty_rose_tn.jpg?v=1586241421,Netcore,Skirts,skirts,midi,red,solid,comfortable
249,Never Forget Skirt In Khaki,Embrace a casual and trendy look with the Never Forget Skirt In Khaki. The khaki color and relaxed design create a stylish and comfortable skirt for everyday wear.,in stock,new,28 USD,https://netcoredemo.myshopify.com/collections/skirts/products/1249,https://cdn.shopify.com/s/files/1/0370/4861/5048/products/2019.1.8_439.jpg?v=1586241423,Netcore,Skirts,skirts,midi,green,solid,comfortable
250,Ready Or Not Skirt In White Linen Look,Step into a chic and sophisticated look with the Ready Or Not Skirt In White Linen Look. The white linen look fabric and classic design create a timeless and versatile skirt.,in stock,new,32 USD,https://netcoredemo.myshopify.com/collections/skirts/products/1250,https://cdn.shopify.com/s/files/1/0370/4861/5048/products/tnlove_you_longtime_skirt_in_white_linen_look.jpg?v=1586241426,Netcore,Skirts,skirts,midi,white,solid,comfortable
251,Parisienne Attitude Skirt In Tan Leatherette,Embrace a chic and edgy look with the Parisienne Attitude Skirt In Tan Leatherette. The tan leatherette fabric adds a touch of sophistication and style.,in stock,new,23 USD,https://netcoredemo.myshopify.com/collections/skirts/products/1251,https://cdn.shopify.com/s/files/1/0370/4861/5048/products/tnparisienne_attitude_skirt_in_tan_leatherette.jpg?v=1586241429,Netcore,Skirts,skirts,midi,yellow,solid,slit
252,Unfold Me Skirt In Blue,Step into a playful and vibrant look with the Unfold Me Skirt In Blue. The blue color and unique design create a fashionable and eye-catching skirt.,in stock,new,29 USD,https://netcoredemo.myshopify.com/collections/skirts/products/1252,https://cdn.shopify.com/s/files/1/0370/4861/5048/products/tnunfold_me_skirt_in_blue.jpg?v=1586241431,Netcore,Skirts,skirts,midi,blue,solid,slit
253,Fashion Game Skirt In Emerald Green Satin,Elevate your style with the Fashion Game Skirt In Emerald Green Satin. The emerald green satin fabric and flowing silhouette create a luxurious and chic skirt.,in stock,new,47 USD,https://netcoredemo.myshopify.com/collections/skirts/products/1253,https://cdn.shopify.com/s/files/1/0370/4861/5048/products/tnfashion_game_skirt_in_emerald_green_satin.jpg?v=1586241434,Netcore,Skirts,skirts,midi,green,solid,slit
254,No More Fears Skirt In Wine Satin,Make a statement with the No More Fears Skirt In Wine Satin. The wine satin fabric and unique design add a touch of elegance and fashion to your outfit.,in stock,new,50 USD,https://netcoredemo.myshopify.com/collections/skirts/products/1254,https://cdn.shopify.com/s/files/1/0370/4861/5048/products/tnno_more_fears_skirt_in_wine_satin.jpg?v=1586241436,Netcore,Skirts,skirts,midi,red,solid,slit
255,San Diego Denim Skirt In Black Wash,Channel a casual and timeless look with the San Diego Denim Skirt In Black Wash. The black wash denim fabric and classic design create a versatile skirt.,in stock,new,40 USD,https://netcoredemo.myshopify.com/collections/skirts/products/1255,https://cdn.shopify.com/s/files/1/0370/4861/5048/products/tnsan_diego_denim_skirt_in_black_wash01.jpg?v=1586241437,Netcore,Skirts,skirts,mini,black,solid,tight
256,Not Happening Skirt In White,Embrace a minimalist and stylish look with the Not Happening Skirt In White. The white color and clean design create a modern and versatile skirt.,in stock,new,40 USD,https://netcoredemo.myshopify.com/collections/skirts/products/1256,https://cdn.shopify.com/s/files/1/0370/4861/5048/products/not_happening_skirt_in_white_tn_1.jpg?v=1586241440,Netcore,Skirts,skirts,mini,white,solid,tight
257,Not Stopping Skirt In Camel Leatherette,Step into a bold and edgy look with the Not Stopping Skirt In Camel Leatherette. The camel leatherette fabric and unique design create a statement-making skirt.,in stock,new,40 USD,https://netcoredemo.myshopify.com/collections/skirts/products/1257,https://cdn.shopify.com/s/files/1/0370/4861/5048/products/not_stopping_skirt_in_camel_leatherette2.jpg?v=1586241443,Netcore,Skirts,skirts,mini,yellow,solid,tight
258,Extra Volume Skirt In Marigold,Embrace a vibrant and playful look with the Extra Volume Skirt In Marigold. The marigold color and voluminous silhouette create a fun and fashionable skirt.,in stock,new,15 USD,https://netcoredemo.myshopify.com/collections/skirts/products/1258,https://cdn.shopify.com/s/files/1/0370/4861/5048/products/tnextra_volume_skirt_in_marigold.jpg?v=1586241445,Netcore,Skirts,skirts,mini,yellow,solid,tight
259,Over And Under Skirt In Emerald Linen Look,Channel a fresh and stylish look with the Over And Under Skirt In Emerald Linen Look. The emerald linen look fabric and unique design create a trendy and eye-catching skirt.,in stock,new,19 USD,https://netcoredemo.myshopify.com/collections/skirts/products/1259,https://cdn.shopify.com/s/files/1/0370/4861/5048/products/tnover_and_under_skirt_in_emerald_linen_look.jpg?v=1586241448,Netcore,Skirts,skirts,mini,green,solid,comfortable
260,Dancing Alone Skirt In Teal,Step into elegance and grace with the Dancing Alone Skirt In Teal. The teal color and flowing silhouette create a feminine and sophisticated skirt.,in stock,new,25 USD,https://netcoredemo.myshopify.com/collections/skirts/products/1260,https://cdn.shopify.com/s/files/1/0370/4861/5048/products/dancing_alone_skirt_in_teal_tn.jpg?v=1586241451,Netcore,Skirts,skirts,mini,blue,solid,comfortable
261,Pretty Damn Good Skirt In Blue Linen Look,Channel a chic and versatile look with the Pretty Damn Good Skirt In Blue Linen Look. The blue linen look fabric and classic design create a timeless and stylish skirt.,in stock,new,40 USD,https://netcoredemo.myshopify.com/collections/skirts/products/1261,https://cdn.shopify.com/s/files/1/0370/4861/5048/products/ropretty_damn_good_skirt_in_blue_linen_look.jpg?v=1586241453,Netcore,Skirts,skirts,mini,blue,solid,comfortable
262,Maroon Ruffle Knit Mini Skater Skirt,Embrace a cute and flirty look with the Maroon Ruffle Knit Mini Skater Skirt. The maroon color and ruffle details add a playful and feminine touch to this mini skirt.,in stock,new,51 USD,https://netcoredemo.myshopify.com/collections/skirts/products/1262,https://cdn.shopify.com/s/files/1/0370/4861/5048/products/11525347787289-N-Gal-Maroon-Ruffle-Knit-Mini-Skater-Skirt-571525347787115-1.jpg?v=1586241455,Netcore,Skirts,skirts,mini,red,solid,comfortable
263,Mini Slip Skirt In Lemon Satin,Step into a sleek and stylish look with the Mini Slip Skirt In Lemon Satin. The lemon satin fabric and minimalist design create a chic and versatile skirt.,in stock,new,35 USD,https://netcoredemo.myshopify.com/collections/skirts/products/1263,https://cdn.shopify.com/s/files/1/0370/4861/5048/products/tnmini_slip_skirt_in_lemon_satin01.jpg?v=1586241458,Netcore,Skirts,skirts,mini,yellow,solid,slit
